{
  "version": "1",
  "change_id": "add-list-holds",
  "summary": "Three-slice shared-contract follow-on (foundation\u2192properties): W1 elevates additive OpenAPI GET /reservations and UML OCL vocabulary for authorized full-dump list and UnauthorizedError; W2 depends_on W1 and delivers authorized list success (empty + nonempty LookupResponse-equivalent dump, shared visibility, no filters, no mutation); W3 depends_on W1 and delivers unauthorized list UnauthorizedError without mutation.",
  "acceptance_of_whole": "Scenario: Soft-hold collection list covers authorized full dump and unauthorized failure\n  Given the inventory reservation service for clients\n  When clients exercise authorized soft-hold collection list (empty and nonempty) and unauthorized list\n  Then authorized list returns all currently visible soft-holds in the same visibility universe as get-by-id with no filter dimensions and without mutating stock or holds\n  And authorized success is one full dump of LookupResponse-equivalent items including availableStock; empty when none are visible\n  And unauthorized list fails with UnauthorizedError without mutating stock or holds (POL-OPAQUE-PRINCIPAL-AUTHZ)\n  And openapi/openapi.yaml documents additive GET /reservations while prior reserve/release/expire/lookup/concurrent operations remain\n  And contracts/**/*.ocl and passing tests/contracts/** cover full-dump list success (including empty) and UnauthorizedError\n  And payments, multi-warehouse, full IAM, UI, notifications, TTL extend, list-by-SKU/filters/paging, and prior Feature rewrites are not required",
  "confidence": "high",
  "human_gate": {
    "required": false,
    "reason": "ChangeBrief scope is explicit; Grill Q1\u2013Q3 Means settled; open_questions are non-blocking deferrals to OpenAPI apply / knowledge harvest; foundation then two property slices map cleanly to R1\u2013R5 and SC1\u2013SC4 without blocking ambiguity."
  },
  "items": [
    {
      "id": "W1",
      "intent": "Elevate additive OpenAPI GET /reservations and UML OCL so authorized full-dump list success (including empty) and UnauthorizedError on list are checkable vocabulary, without removing or renaming prior reserve/release/expire/lookup/concurrent surfaces.",
      "acceptance_criterion": "Scenario: OpenAPI and OCL elevate collection list vocabulary for GET /reservations\n  Given the reservation OpenAPI and module OCL surfaces\n  When the collection list operation and list failure channels are inspected\n  Then OpenAPI documents additive GET /reservations alongside existing POST /reservations and GET /reservations/{holdId}\n  And prior reserve, release, expire, lookup, and concurrent surfaces remain\n  And UML OCL makes authorized full-dump list success (including empty) and UnauthorizedError on list checkable",
      "covers": [
        "R4",
        "R5",
        "SC4"
      ],
      "touches": [
        "openapi/openapi.yaml",
        "contracts/Reservation.ocl"
      ],
      "feature_path": "requirements/reservation-list-holds.feature",
      "scenario_name": "OpenAPI and OCL elevate collection list vocabulary for GET /reservations",
      "depends_on": [],
      "status": "done",
      "confidence": "high",
      "human_gate": {
        "required": false,
        "reason": "Additive GET /reservations and OCL list vocabulary elevation are unambiguous from the Brief; density and exact JSON envelope deferred to judge/apply."
      }
    },
    {
      "id": "W2",
      "intent": "Deliver authorized collection list so any authorized opaque principal receives one full dump of all currently visible soft-holds (LookupResponse-equivalent including availableStock; empty OK; same visibility as get-by-id; no filters; no mutation), extending OCL-derived Vitest and implementation after W1.",
      "acceptance_criterion": "Scenario: Authorized list returns a full dump of visible soft-holds without mutation\n  Given a reservation service with zero or more currently visible soft-holds\n  And an authorized opaque principal\n  When the principal lists soft-holds\n  Then the service returns all currently visible soft-holds in the same visibility universe as get-by-id\n  And the response is one full dump with no paging and no sku, status, or time filter dimensions\n  And each item is LookupResponse-equivalent with holdId, sku, quantity, expiresAt, and availableStock\n  And the collection is empty when none are visible\n  And stock and holds are unchanged",
      "covers": [
        "R1",
        "R2",
        "SC1",
        "SC2"
      ],
      "touches": [
        "contracts/Reservation.ocl",
        "tests/contracts/reservation.test.ts",
        "src/reservation.ts",
        "src/server.ts"
      ],
      "feature_path": "requirements/reservation-list-holds.feature",
      "scenario_name": "Authorized list returns a full dump of visible soft-holds without mutation",
      "depends_on": [
        "W1"
      ],
      "status": "done",
      "confidence": "high",
      "human_gate": {
        "required": false,
        "reason": "Authorized full-dump list success (empty and nonempty) follows settled Grill Means; exact success JSON envelope deferred to OpenAPI apply."
      }
    },
    {
      "id": "W3",
      "intent": "Fail soft-hold collection list with UnauthorizedError and no stock/hold mutation when the caller is unauthorized (POL-OPAQUE-PRINCIPAL-AUTHZ), extending remaining OCL/tests/impl only as needed after W1.",
      "acceptance_criterion": "Scenario: Unauthorized list fails with UnauthorizedError without mutation\n  Given a reservation service with stock and soft-holds\n  And an unauthorized caller\n  When the caller attempts to list soft-holds\n  Then the operation fails with UnauthorizedError\n  And stock and holds are unchanged",
      "covers": [
        "R3",
        "SC3"
      ],
      "touches": [
        "tests/contracts/reservation.test.ts",
        "src/reservation.ts",
        "src/server.ts"
      ],
      "feature_path": "requirements/reservation-list-holds.feature",
      "scenario_name": "Unauthorized list fails with UnauthorizedError without mutation",
      "depends_on": [
        "W1"
      ],
      "status": "done",
      "confidence": "high",
      "human_gate": {
        "required": false,
        "reason": "Unauthorized list UnauthorizedError and no-mutation follow canonical POL-OPAQUE-PRINCIPAL-AUTHZ; error JSON deferred to apply."
      }
    }
  ]
}
